Gene Symbol	Name
ASXL1	additional sex combs like 1
GNAS	guanine nucleotide binding protein (G protein), alpha stimulating activity polypeptide 1
MAFB	v-maf musculoaponeurotic fibrosarcoma oncogene homolog B (avian)
NFATC2	nuclear factor of activated T-cells, cytoplasmic, calcineurin-dependent 2
PLCG1	phospholipase C, gamma 1
PTK6	protein tyrosine kinase 6
PTPRT	protein tyrosine phosphatase, receptor type T
SALL4	spalt like transcription factor 4
SDC4	syndecan 4
SRC	SRC proto-oncogene, non-receptor tyrosine kinase
SS18L1	synovial sarcoma translocation gene on chromosome 18-like 1
TOP1	topoisomerase (DNA) I
